original_review,comment_clean,sentiment_label,label_numeric
Initially harder to set up called tech wasn’t that knowledgeable now working great.,initially harder to set up called tech wasn’t that knowledgeable now working great.,positive,2
It was very easy to set up and my family love it’s!,it was very easy to set up and my family love it’s!,positive,2
Has great sound and is very responsive my voice and commands.,has great sound and is very responsive my voice and commands.,positive,2
How did I live this long without the Echo . You get to enjoy any music style  just my asking Alexa . Going to up-greade to the wireless . Love the Echo . Love you too Alexa .,how did i live this long without the echo . you get to enjoy any music style  just my asking alexa . going to up-greade to the wireless . love the echo . love you too alexa .,positive,2
Very cool product. Speaker sounds good with my Spotify blasting through it.,very cool product. speaker sounds good with my spotify blasting through it.,positive,2
Having so much fun with Alexa. Love being able to listen to music when I’m across the room or busy doing something else.,having so much fun with alexa. love being able to listen to music when i’m across the room or busy doing something else.,positive,2
"So far it seems to be a very nice item. It picks up on my voice and understands me without any problems. The other day I asked it to turn down the music from the next room and it heard me just fine. I've only used it to listen to music and check the weather, but it has done both of those things very well.","so far it seems to be a very nice item. it picks up on my voice and understands me without any problems. the other day i asked it to turn down the music from the next room and it heard me just fine. i've only used it to listen to music and check the weather, but it has done both of those things very well.",positive,2
Love our echo,love our echo,positive,2
"I love it,she is very helpful. I use her for remembering things and sleep. You can ask her just about anything. I have only had her for about a week so still learning her.","i love it,she is very helpful. i use her for remembering things and sleep. you can ask her just about anything. i have only had her for about a week so still learning her.",positive,2
"It's better than the 1st gen in every way except for one.  I really miss the ring at the top for volume control.  It was quicker and easier to just grab the top and twist without having to look at the buttons and find the &#34;-&#34; one and press it a few times.  I also wish the bass was a bit better.  All in all, it's a great device and I'm happy with it.","it's better than the 1st gen in every way except for one.  i really miss the ring at the top for volume control.  it was quicker and easier to just grab the top and twist without having to look at the buttons and find the &#34;-&#34; one and press it a few times.  i also wish the bass was a bit better.  all in all, it's a great device and i'm happy with it.",positive,2
I love having an Alexa!,i love having an alexa!,positive,2
So far I like it 🤓,so far i like it 🤓,positive,2
I am thoroughly enjoying my Ecoo!  Love to have it read my audiobook to me while in the office and then I can simply open the audiobook on my kindle to continue it when elsewhere. Wonderful for listening to music when not in the mood for a book. Great for setting reminders for myself too and so much more.,i am thoroughly enjoying my ecoo!  love to have it read my audiobook to me while in the office and then i can simply open the audiobook on my kindle to continue it when elsewhere. wonderful for listening to music when not in the mood for a book. great for setting reminders for myself too and so much more.,positive,2
Still love it,still love it,positive,2
Love it,love it,positive,2
"I love the sound quality of this unit, it is a very clear sound.","i love the sound quality of this unit, it is a very clear sound.",positive,2
I just this for listening to talk radio in the morning and turning lights on and off etc. The system does an excellent job as a full house sound system streaming Sirius.,i just this for listening to talk radio in the morning and turning lights on and off etc. the system does an excellent job as a full house sound system streaming sirius.,positive,2
"I have had for only a week, so I am still learning all that Alexa can do.  It is a learning process.  I love the music I can call up any time.  I listen to podcasts and radio stations.  I have just started keeping shopping lists and grocery lists, which I love.  I don’t have to search for paper and pencil.  Getting time and temperature are great, do not have to wait for weather reports.  The sound is good.  I am not fussy about woofers, tweeters, base , etc.  the Echo is fine for me.  This afternoon I am going to try “dropping in”.on my son when he gets home.  Going to surprise him.","i have had for only a week, so i am still learning all that alexa can do.  it is a learning process.  i love the music i can call up any time.  i listen to podcasts and radio stations.  i have just started keeping shopping lists and grocery lists, which i love.  i don’t have to search for paper and pencil.  getting time and temperature are great, do not have to wait for weather reports.  the sound is good.  i am not fussy about woofers, tweeters, base , etc.  the echo is fine for me.  this afternoon i am going to try “dropping in”.on my son when he gets home.  going to surprise him.",positive,2
Not much features.,not much features.,negative,0
"Great sound quality, great features, great product. Multi room music is very cool.","great sound quality, great features, great product. multi room music is very cool.",positive,2
Cool,cool,positive,2
Everyone should have an Echo or two or three or more. I bought my Echo through QVC.,everyone should have an echo or two or three or more. i bought my echo through qvc.,positive,2
it's annoying that everything they show Alexa as being able to do has to be downloaded. You spend so  much time trying to figure out how to phrase it for the machine that you may as well just look it up yourself,it's annoying that everything they show alexa as being able to do has to be downloaded. you spend so  much time trying to figure out how to phrase it for the machine that you may as well just look it up yourself,neutral,1
I have had Alexa since the beginning.  I accidentally spilled water on her and have replaced it with the 2nd generation.  I decided I couldn't be without an Echo.  Setup was easy and had it working within minutes.,i have had alexa since the beginning.  i accidentally spilled water on her and have replaced it with the 2nd generation.  i decided i couldn't be without an echo.  setup was easy and had it working within minutes.,positive,2
"I like being able to tell Alexia the music I want to hear, but sometimes she has trouble finding the song if I am not very specific about the title.","i like being able to tell alexia the music i want to hear, but sometimes she has trouble finding the song if i am not very specific about the title.",positive,2
I like the looks better than the original echo.  I moved my old echo to the basement family room. Nice sound.,i like the looks better than the original echo.  i moved my old echo to the basement family room. nice sound.,positive,2
The Echo is wonderful but I'm still learning how to use it. Music requests are somewhat limited.,the echo is wonderful but i'm still learning how to use it. music requests are somewhat limited.,positive,2
"Doesn't know half the things asked. Can't recognize my sprinkler wifi controller, even though product details says it is compatible. Can't program or change my wifi thermostat settings and its matched up on same wifi router. Just a handy music player. That's if you have Amazon Music.","doesn't know half the things asked. can't recognize my sprinkler wifi controller, even though product details says it is compatible. can't program or change my wifi thermostat settings and its matched up on same wifi router. just a handy music player. that's if you have amazon music.",neutral,1
Love it,love it,positive,2
awesome.understands my kids,awesome.understands my kids,positive,2
We were pleasantly surprised at the sound quality and the many features. How nice to easily hear a particular artist or hear our books just by a simple command. Looking forward to exploring other options with this device.,we were pleasantly surprised at the sound quality and the many features. how nice to easily hear a particular artist or hear our books just by a simple command. looking forward to exploring other options with this device.,positive,2
Met and exceeded my expectations. Easy set up and is really quick in responses.,met and exceeded my expectations. easy set up and is really quick in responses.,positive,2
"I like the fact that I can get any kind of music from Prime that I want on request from Alexa. I liked the informative photo little pamphlet but wish it included how to connect your TV etc. to the commands from Alexa. BUT, I really love having the music.","i like the fact that i can get any kind of music from prime that i want on request from alexa. i liked the informative photo little pamphlet but wish it included how to connect your tv etc. to the commands from alexa. but, i really love having the music.",positive,2
"i have not found a way to access my echo thorough my prime account.  I think it should be part of the top line with video, music, etc.  I also think the setup app where i define, for example music i like, is not well integrated into echo.  I have tried to ask for my playlist and echo is not sure even though i set up play list in my settings.  I also do not like the fact that my words have to be exact match of my playlist names, which i can never remember.I like the ready nature of echo to respond to most any queries.","i have not found a way to access my echo thorough my prime account.  i think it should be part of the top line with video, music, etc.  i also think the setup app where i define, for example music i like, is not well integrated into echo.  i have tried to ask for my playlist and echo is not sure even though i set up play list in my settings.  i also do not like the fact that my words have to be exact match of my playlist names, which i can never remember.i like the ready nature of echo to respond to most any queries.",positive,2
This is great item and just added audible books which makes it even better. Thank you!,this is great item and just added audible books which makes it even better. thank you!,positive,2
"During Prime Day this 2nd gen Echo was on sale so I couldn't resist! This was the beginning to my smart home set up and I couldn't be happier to say that Alexa has done an amazing job connecting to all of my ""smart"" devices. Thanks to her, I can control my lights, smart plugs, TV, etc. I had no trouble connecting the Echo to my WiFi and my phone. The app works perfectly fine and it let's you add skills, routines, smart devices, timers, and so much more! Sound quality is good enough for me, since I am not an audiophile. Alexa can hear my voice even when watching movies at a high volume. Design is great and modern, it will definitely add a nice touch to your home and you can change the covers if you'd like as there are more for sale. Overall, this is a great addition to my home and enables so many possibilities. If you haven't yet, be sure to add Alexa to your home!","during prime day this 2nd gen echo was on sale so i couldn't resist! this was the beginning to my smart home set up and i couldn't be happier to say that alexa has done an amazing job connecting to all of my ""smart"" devices. thanks to her, i can control my lights, smart plugs, tv, etc. i had no trouble connecting the echo to my wifi and my phone. the app works perfectly fine and it let's you add skills, routines, smart devices, timers, and so much more! sound quality is good enough for me, since i am not an audiophile. alexa can hear my voice even when watching movies at a high volume. design is great and modern, it will definitely add a nice touch to your home and you can change the covers if you'd like as there are more for sale. overall, this is a great addition to my home and enables so many possibilities. if you haven't yet, be sure to add alexa to your home!",positive,2
Versatile and fun !!!,versatile and fun !!!,positive,2
Works great! Killer speaker! My wife and son love it.,works great! killer speaker! my wife and son love it.,positive,2
We regret waiting so long to purchase this item. We are both surprised and pleased with the sound quality.,we regret waiting so long to purchase this item. we are both surprised and pleased with the sound quality.,positive,2
"Stopped working after 2 weeks ,didn't follow commands!? Really fun when it was working?","stopped working after 2 weeks ,didn't follow commands!? really fun when it was working?",negative,0
so far love it working on getting more things set up love the grocery list app,so far love it working on getting more things set up love the grocery list app,positive,2
"It performs pretty much as expected, but I am very disappointed it will not provide me with the terminology I need to play various kinds of music without subscribing to the Amazon music service.  I understand my music choices may be limited, but without knowing HOW TO ASK, I cannot access the music that is provided free along with my Echo purchase.  Do you have a chart showing the language I need to use?","it performs pretty much as expected, but i am very disappointed it will not provide me with the terminology i need to play various kinds of music without subscribing to the amazon music service.  i understand my music choices may be limited, but without knowing how to ask, i cannot access the music that is provided free along with my echo purchase.  do you have a chart showing the language i need to use?",positive,2
Easy to set up.,easy to set up.,positive,2
I like the product except that the speakers are not the high quality I expected,i like the product except that the speakers are not the high quality i expected,neutral,1
A great investment. Alexa has helped me out and made me laugh.,a great investment. alexa has helped me out and made me laugh.,positive,2
Yet another Exho for our home and love them all!!!,yet another exho for our home and love them all!!!,positive,2
"I love it, I can plan any gender of music from big band to jazz, not easy to find on local radio. Sound is good and I can stop it with a voice command if I get a phone call.","i love it, i can plan any gender of music from big band to jazz, not easy to find on local radio. sound is good and i can stop it with a voice command if i get a phone call.",positive,2
Good Value,good value,positive,2
Super easy set up and am loving our new Echo!,super easy set up and am loving our new echo!,positive,2
Whats not to like about this speaker.  Just ask Alexa,whats not to like about this speaker.  just ask alexa,positive,2
BEST father's day gift. Dad joked to my mom that Alexa will be the one listening to all of his (repeated) stories going forward.,best father's day gift. dad joked to my mom that alexa will be the one listening to all of his (repeated) stories going forward.,positive,2
Great addition to our breakfast room kitchen.  Tunes and information instantly available.  Slowly learning more features.,great addition to our breakfast room kitchen.  tunes and information instantly available.  slowly learning more features.,positive,2
Sound quality,sound quality,positive,2
Sad joke. Worthless.,sad joke. worthless.,negative,0
Entertainment,entertainment,positive,2
Very good quality,very good quality,positive,2
Works great sounds great does not miss a beat wish it had a battery for better portability,works great sounds great does not miss a beat wish it had a battery for better portability,positive,2
Loved it till someone stoled it. Can't afford to replace it yet but I am going too.,loved it till someone stoled it. can't afford to replace it yet but i am going too.,positive,2
Alexa rocks,alexa rocks,positive,2
"Got this as a gift and love it. I never would have bought one for myself, but now that I have it.... Allows me to play music on it from my amozon prime music ; that's worth it in and of itself.  Also, gives new's briefs and tells jokes.","got this as a gift and love it. i never would have bought one for myself, but now that i have it.... allows me to play music on it from my amozon prime music ; that's worth it in and of itself.  also, gives new's briefs and tells jokes.",positive,2
 ,,neutral,1
"My mom bought a few Echo Dots and repeated ask me to take one of hers because it was so great. I told her “no” for two days. When she made me take it, 6 hours later I could not live my life without it!  It’s that amazing, so now we have four large speakers and only the small Echo Dot, that I will be returning to her. I say if you’re going to order an Alexa speaker, go big and get the Echo, otherwise tou’ll Be returning the two Echo Dots you couldn’t live without.","my mom bought a few echo dots and repeated ask me to take one of hers because it was so great. i told her “no” for two days. when she made me take it, 6 hours later i could not live my life without it!  it’s that amazing, so now we have four large speakers and only the small echo dot, that i will be returning to her. i say if you’re going to order an alexa speaker, go big and get the echo, otherwise tou’ll be returning the two echo dots you couldn’t live without.",positive,2
Love it!! Great product!!!,love it!! great product!!!,positive,2
Easy set up very user friendly,easy set up very user friendly,positive,2
"Really disappointed Alexa has to be plug-in to wall socket all the time.  My fault for not checking this, but made the assumption that a company has technologically advanced as Amazon would sell this product with a rechargeable battery.  If I could return it, I would as my Apple music and boom speaker give me more flexibility the Alexa.","really disappointed alexa has to be plug-in to wall socket all the time.  my fault for not checking this, but made the assumption that a company has technologically advanced as amazon would sell this product with a rechargeable battery.  if i could return it, i would as my apple music and boom speaker give me more flexibility the alexa.",negative,0
I don't think the &#34;2nd gen&#34; sounds as good as the 1st.  But it does have an aux out... so you could add an external speaker.  But if you are going to do that why wouldn't you just get a dot?  2nd issue is (which isn't unique to this unit but I don't understand why I can't override the default that prevents you from playing a blue tooth speaker while playing through a &#34;group&#34;.  I get there is a delay when using a BT speaker.  But if the other units are not where they can be heard then I should be able to play as a group while using the BT speaker.,i don't think the &#34;2nd gen&#34; sounds as good as the 1st.  but it does have an aux out... so you could add an external speaker.  but if you are going to do that why wouldn't you just get a dot?  2nd issue is (which isn't unique to this unit but i don't understand why i can't override the default that prevents you from playing a blue tooth speaker while playing through a &#34;group&#34;.  i get there is a delay when using a bt speaker.  but if the other units are not where they can be heard then i should be able to play as a group while using the bt speaker.,neutral,1
Everything,everything,positive,2
I like the interaction of asking questions. I don’t like that I can’t ask her to setup schedule of off and on of connected lamp.,i like the interaction of asking questions. i don’t like that i can’t ask her to setup schedule of off and on of connected lamp.,neutral,1
Supberb sound! Definitely worth the extra money if you listen to lots of music.,supberb sound! definitely worth the extra money if you listen to lots of music.,positive,2
I really love my amazon echo. I think the sound quality is great and we have a lot of fun with it. It is really handy for music and to get updates on the weather and sports!,i really love my amazon echo. i think the sound quality is great and we have a lot of fun with it. it is really handy for music and to get updates on the weather and sports!,positive,2
Love it!  So do the grandkids!!,love it!  so do the grandkids!!,positive,2
"So far it has worked well. Not always intuitive as to how to link different devices, or ""skills"", but getting the hang of it.","so far it has worked well. not always intuitive as to how to link different devices, or ""skills"", but getting the hang of it.",positive,2
Works as advertised,works as advertised,positive,2
I love it!,i love it!,positive,2
"Love my new addition to the house! Speaker quality is great and over all we love our Alexa. My only two ( not complaints, more suggestions for the future series) would be better communication ability. Example: For our smart lights in the house. Unless we specify kitchen Light 1 or kitchen Light 2 prior to the command she either won’t respond or says she doesn’t recognize. It may be me, but I want my Alexa to respond when I say thank you afterwards. I have to repeat Alexa thank you and there are times she won’t respond to me, but will my husband. I know it sounds odd. We laugh about it, but maybe it’s a Southern thing but I want my Alexa to have manners too.","love my new addition to the house! speaker quality is great and over all we love our alexa. my only two ( not complaints, more suggestions for the future series) would be better communication ability. example: for our smart lights in the house. unless we specify kitchen light 1 or kitchen light 2 prior to the command she either won’t respond or says she doesn’t recognize. it may be me, but i want my alexa to respond when i say thank you afterwards. i have to repeat alexa thank you and there are times she won’t respond to me, but will my husband. i know it sounds odd. we laugh about it, but maybe it’s a southern thing but i want my alexa to have manners too.",positive,2
"Like everything about it. The music, the trivia games, the weather.","like everything about it. the music, the trivia games, the weather.",positive,2
As described and received on time.  Do not like automatic enrolment into music.,as described and received on time.  do not like automatic enrolment into music.,positive,2
A great device,a great device,positive,2
I owned an echo for overa year but the new lacks the easy way to increase or decrease volume without telling it to increase or decrease volume which is hard to do for my wife since English is her second language she was born in korea. But the sound from the echo is superb. So we’ll keep it..,i owned an echo for overa year but the new lacks the easy way to increase or decrease volume without telling it to increase or decrease volume which is hard to do for my wife since english is her second language she was born in korea. but the sound from the echo is superb. so we’ll keep it..,neutral,1
Love this!  Have it in the kitchen and works well!,love this!  have it in the kitchen and works well!,positive,2
Very nice!  I'm impressed - wish she had more to say though.,very nice!  i'm impressed - wish she had more to say though.,positive,2
Love the product. Nice to have easy access to so much info!!!,love the product. nice to have easy access to so much info!!!,positive,2
It's got great sound and bass but it doesn't work all of the time. Its still hot or miss when it recognizes things,it's got great sound and bass but it doesn't work all of the time. its still hot or miss when it recognizes things,negative,0
We are still discovering all that the Echo can do.,we are still discovering all that the echo can do.,positive,2
Amazing paroduct,amazing paroduct,positive,2
Good hearing range and sound quality. It was a bit complicated to set up and she doesn't quite understand me a lot even when I am speaking slowly and clearly but I love the flash briefing feature and interfacing with my abode home security system.,good hearing range and sound quality. it was a bit complicated to set up and she doesn't quite understand me a lot even when i am speaking slowly and clearly but i love the flash briefing feature and interfacing with my abode home security system.,positive,2
speaker sounds good,speaker sounds good,positive,2
Absolutely love!!,absolutely love!!,positive,2
The best part of this product is you can control the thermostat and lights for your house.  There isn’t anything I dislike.,the best part of this product is you can control the thermostat and lights for your house.  there isn’t anything i dislike.,positive,2
We're thoroughly enjoying our Amazon Echo. Installation was easy using the Alexa app. I purchased 2 Kasa smart plugs to control our living room lights. Installation again was easy using the Kasa app. They sinqued right up with the Echo. We're enjoying playing music with the Echo and the sound quality is awesome. We've added a Kasa smart bulb for our kitchen. Setup was seamless. We're looking forward to adding more automation to our home.,we're thoroughly enjoying our amazon echo. installation was easy using the alexa app. i purchased 2 kasa smart plugs to control our living room lights. installation again was easy using the kasa app. they sinqued right up with the echo. we're enjoying playing music with the echo and the sound quality is awesome. we've added a kasa smart bulb for our kitchen. setup was seamless. we're looking forward to adding more automation to our home.,positive,2
Home entertainment,home entertainment,positive,2
