original_review,comment_clean,sentiment_label,label_numeric
"Great addition to the Alexa family.  Nice having the &#34;visual&#34; part of pics, recipes, etc.","great addition to the alexa family.  nice having the &#34;visual&#34; part of pics, recipes, etc.",positive,2
We love it!!  We use it every day and are finding new ways to use it the longer we have it!,we love it!!  we use it every day and are finding new ways to use it the longer we have it!,positive,2
I have been through 4 Shows now.  And ALL OF THEM HAVE BEEN BROKEN.  It has been anything from screens that lose lines of resolution to timers and reminders going off an hour late or reminders that trigger when trying to set other reminders.  I don't have these issues on my Dot or my Echo.  Just on the Show.  It would be nice if Amazon could get there act together and actually fix this thing.,i have been through 4 shows now.  and all of them have been broken.  it has been anything from screens that lose lines of resolution to timers and reminders going off an hour late or reminders that trigger when trying to set other reminders.  i don't have these issues on my dot or my echo.  just on the show.  it would be nice if amazon could get there act together and actually fix this thing.,negative,0
Easy set up,easy set up,positive,2
"Pleased with the Echo, it is loud and can hear my voice and understand much better than previous versions.","pleased with the echo, it is loud and can hear my voice and understand much better than previous versions.",positive,2
"Love it!  Great to request music and be able to see lyrics.  I had a dot, but this is so much better.","love it!  great to request music and be able to see lyrics.  i had a dot, but this is so much better.",positive,2
What we liked most was actually seeing the words to song. Least would be I guess I expected a little more from her than is currently available.,what we liked most was actually seeing the words to song. least would be i guess i expected a little more from her than is currently available.,positive,2
"I’m just learning about this product, but what I know I love !","i’m just learning about this product, but what i know i love !",positive,2
Easy to use!,easy to use!,positive,2
it does what it needs to.,it does what it needs to.,positive,2
"I love this product.  I'm not very computer literate but everything is voice controlled.  I use this to keep in touch with my daughter, she lives out of town.  Now we just drop in on each other. It's like we are living net door to each other.","i love this product.  i'm not very computer literate but everything is voice controlled.  i use this to keep in touch with my daughter, she lives out of town.  now we just drop in on each other. it's like we are living net door to each other.",positive,2
I enjoy seeing lyrics on the screen for different Amazon music stations,i enjoy seeing lyrics on the screen for different amazon music stations,positive,2
love the Echo show great in  kitchen  for recipes,love the echo show great in  kitchen  for recipes,positive,2
"Alexa is pretty dumb ,,,","alexa is pretty dumb ,,,",negative,0
Only problem is my slow internet. I really like the speaker on it. Having tons of fun with it,only problem is my slow internet. i really like the speaker on it. having tons of fun with it,positive,2
"Love my Echo Show. Alexa is amazing and now on the Show &#34;she&#34; can display lyrics, photos, etc. The speakers are amazing and fills the room. Bought on Prime Day so got a great deal, so worth it.","love my echo show. alexa is amazing and now on the show &#34;she&#34; can display lyrics, photos, etc. the speakers are amazing and fills the room. bought on prime day so got a great deal, so worth it.",positive,2
LOVE MY ECHO SHOW.  Everything about this device is wonderful,love my echo show.  everything about this device is wonderful,positive,2
"Used to have fun with. Great to play music, turn on lights and who know what else.","used to have fun with. great to play music, turn on lights and who know what else.",positive,2
"Works great , seems to be a delay bringing up ring cameras but sound and video quality are good","works great , seems to be a delay bringing up ring cameras but sound and video quality are good",positive,2
Works on great i  use it with my Arlo security system,works on great i  use it with my arlo security system,positive,2
"this is so fun! I really enjoy using it. I have it hooked up to one of my lights so I just tell Alexa when I want that on and off. also, it connects to my Spotify so I just have Alexa resume my playlist and we pick off right where we ended. I feel like there's even more I can do with this, so I'm excited to use it more!","this is so fun! i really enjoy using it. i have it hooked up to one of my lights so i just tell alexa when i want that on and off. also, it connects to my spotify so i just have alexa resume my playlist and we pick off right where we ended. i feel like there's even more i can do with this, so i'm excited to use it more!",positive,2
"Upgraded from an original Echo on Prime Day and so far I love it. I'm sure I have a long way to go to maximize its utility,  but for now I owe my marked increase in lyrical knowledge to this thing. Who knew Post Malone actually used words?!","upgraded from an original echo on prime day and so far i love it. i'm sure i have a long way to go to maximize its utility,  but for now i owe my marked increase in lyrical knowledge to this thing. who knew post malone actually used words?!",positive,2
You can't access YouTube! Why do consumer's have to pay for this argument! Why can't we just have a good product that offers what we need?,you can't access youtube! why do consumer's have to pay for this argument! why can't we just have a good product that offers what we need?,neutral,1
 ,,positive,2
Still learning about the Echo show but so far we love it. My 9 year old loves to cook and especially with his Aunt that lives out of state and now he can connect with her and they cook together.,still learning about the echo show but so far we love it. my 9 year old loves to cook and especially with his aunt that lives out of state and now he can connect with her and they cook together.,positive,2
"I love having this on my desk. The fact that I can video with friends, listen to music with the words right there, and see my Amazon Cloud Cam feeds from one location is pretty spectacular. I got this one sale too, which was stellar. It has me thinking I need another one for the front room.","i love having this on my desk. the fact that i can video with friends, listen to music with the words right there, and see my amazon cloud cam feeds from one location is pretty spectacular. i got this one sale too, which was stellar. it has me thinking i need another one for the front room.",positive,2
Love it!,love it!,positive,2
Love my echo show! Great sound and picture. Does a great job thing in my entire echo collection!,love my echo show! great sound and picture. does a great job thing in my entire echo collection!,positive,2
Can’t change voice of Echo,can’t change voice of echo,positive,2
Does everything I could ask and more. Great product.,does everything i could ask and more. great product.,positive,2
I like how clear the screen is. Hi resolution,i like how clear the screen is. hi resolution,positive,2
It is so easy to use and is everything I hoped for,it is so easy to use and is everything i hoped for,positive,2
"I love the Echo Show. I’m going off to live on campus for school in the fall and we got two of these to serve as an easy way to connect. Some people might not like the camera but that makes little sense. We carry devices with cameras all the time. The only difference here is that the item is stationary. My family and I also find the drop-in feature a comfort rather than an invasion of privacy. It’s definitely a source of relief to my parents that they can so easily pop in onme and visa versa.I’d also like to thank Amazon for including their VoiceView screen reader on the device. The Show would be a lot less blind friendly, even with Alexa present, if they hadn’t included that.We are an echo-loving household with two dots, three echos, and now two Shows. I wouldn’t be surprised if we got more in the future for ourselves or loved ones. Thanks, Amazon!","i love the echo show. i’m going off to live on campus for school in the fall and we got two of these to serve as an easy way to connect. some people might not like the camera but that makes little sense. we carry devices with cameras all the time. the only difference here is that the item is stationary. my family and i also find the drop-in feature a comfort rather than an invasion of privacy. it’s definitely a source of relief to my parents that they can so easily pop in onme and visa versa.i’d also like to thank amazon for including their voiceview screen reader on the device. the show would be a lot less blind friendly, even with alexa present, if they hadn’t included that.we are an echo-loving household with two dots, three echos, and now two shows. i wouldn’t be surprised if we got more in the future for ourselves or loved ones. thanks, amazon!",positive,2
I love it it is awesome,i love it it is awesome,positive,2
Very Good to be able to listen to Every single song at any time in Amazon's vast library. We're only just beginning to know everything Echo Show has to offer. Well worth the price!! Alexa is very helpful.,very good to be able to listen to every single song at any time in amazon's vast library. we're only just beginning to know everything echo show has to offer. well worth the price!! alexa is very helpful.,positive,2
Love it!,love it!,positive,2
"Great sound and the screen is nice to actually see time, trivia, etc.","great sound and the screen is nice to actually see time, trivia, etc.",positive,2
This has been perfect for being able to see my canary cameras and that’s exactly what I wanted! I have been happy with all my Alexa’s because we have several and this is a great addition.,this has been perfect for being able to see my canary cameras and that’s exactly what i wanted! i have been happy with all my alexa’s because we have several and this is a great addition.,positive,2
I really love this item!  So much fun!,i really love this item!  so much fun!,positive,2
I agree ...YouTube should be on there.,i agree ...youtube should be on there.,positive,2
"We like it a lot, sound is better than the original echo, the bass feels deeper.  The screen is cool, though, havent got a lot of use out of it though.","we like it a lot, sound is better than the original echo, the bass feels deeper.  the screen is cool, though, havent got a lot of use out of it though.",positive,2
Good sound! The capacity of join different apps to make work your smart home,good sound! the capacity of join different apps to make work your smart home,positive,2
"Great addition to the Alexa family, just wish it could use the screen more than backgrounds. Don't get me wrong I don't regret buying it especially for the primeday sale of $100 off sale price but for now the skills for the show are lacking.","great addition to the alexa family, just wish it could use the screen more than backgrounds. don't get me wrong i don't regret buying it especially for the primeday sale of $100 off sale price but for now the skills for the show are lacking.",positive,2
I've had previous experience with the echo Dot and this just blows all previous expectations out of the water!It's great since it can play videos and music from multiple sources and the speakers are pretty loud.,i've had previous experience with the echo dot and this just blows all previous expectations out of the water!it's great since it can play videos and music from multiple sources and the speakers are pretty loud.,positive,2
"Love the echo show, can keep I can video chat with the kids and grandkids. I have it in the kitchen, so when I run out of something I have Alexa to add it to my grocery list. I use it for everything. Was very easy to set up","love the echo show, can keep i can video chat with the kids and grandkids. i have it in the kitchen, so when i run out of something i have alexa to add it to my grocery list. i use it for everything. was very easy to set up",positive,2
I’m really hoping for skills that take advantage of the shows touch screen. There’s an incredible amount of untapped potential locked behind the restrictions. Make use of the best part of having the show and enable skills to navigate by touch please!,i’m really hoping for skills that take advantage of the shows touch screen. there’s an incredible amount of untapped potential locked behind the restrictions. make use of the best part of having the show and enable skills to navigate by touch please!,positive,2
Love it l. I plan on getting an echo for the kitchen.,love it l. i plan on getting an echo for the kitchen.,positive,2
It does not pick up my voice unless I yell most times.,it does not pick up my voice unless i yell most times.,neutral,1
great love it,great love it,positive,2
Amazing!,amazing!,positive,2
Fire HD does so much more.  Over priced pair of speakers.,fire hd does so much more.  over priced pair of speakers.,negative,0
"Seems to be a good product but, unable to play music in sync with my Sonos system. Sonos doesn't seem to recognize it at all.","seems to be a good product but, unable to play music in sync with my sonos system. sonos doesn't seem to recognize it at all.",neutral,1
Great product.  Like the apps that I can connect to it.,great product.  like the apps that i can connect to it.,positive,2
I love it now able to talk to my grandson with ease and the picture quality is great,i love it now able to talk to my grandson with ease and the picture quality is great,positive,2
"Love it! Easy setup and I can ‘Drop in’ on my daughter and son-in-law who live in St. Louis anytime. Everyone loves to have their mother drop in, right 😎","love it! easy setup and i can ‘drop in’ on my daughter and son-in-law who live in st. louis anytime. everyone loves to have their mother drop in, right 😎",positive,2
Fun,fun,positive,2
I use this to control my smart home.,i use this to control my smart home.,positive,2
"Show has been great. Still learning what it can do, but being able to watch videos, talk face to face with others are not features.","show has been great. still learning what it can do, but being able to watch videos, talk face to face with others are not features.",positive,2
Wish I bought one for work too,wish i bought one for work too,positive,2
"Very intrusive, so I turn it off","very intrusive, so i turn it off",negative,0
Love the echo show,love the echo show,positive,2
Works well. Not thrilled that most of the apps have to be paid for seprately.,works well. not thrilled that most of the apps have to be paid for seprately.,positive,2
Video calls to Mom,video calls to mom,positive,2
"Love being able to see, as well as hear things.  Sound is better, too!","love being able to see, as well as hear things.  sound is better, too!",positive,2
I love it,i love it,positive,2
Just like any other echo. Doesn’t disappoint,just like any other echo. doesn’t disappoint,positive,2
"Nice picture good sound but the mics are not as sensitive as a dot, my dots can hear me from across the house the Show does not, that being said I LOVE the show!!I can watch TV and movies while in tg ed kitchen, have the News playing or Music....love....it !!","nice picture good sound but the mics are not as sensitive as a dot, my dots can hear me from across the house the show does not, that being said i love the show!!i can watch tv and movies while in tg ed kitchen, have the news playing or music....love....it !!",positive,2
"I basically use it to play music  and tell me the news..its sometimes hard to communicate with it, if i dont say the command correctly, but i realize its learning my style of speaking and will do some commands even though i dont say them exactly as i should.","i basically use it to play music  and tell me the news..its sometimes hard to communicate with it, if i dont say the command correctly, but i realize its learning my style of speaking and will do some commands even though i dont say them exactly as i should.",positive,2
 ,,negative,0
Upgraded from echo to echo show.,upgraded from echo to echo show.,positive,2
"I love the Echo Show!! I have the dot and have been using that for the last 6 months,  but the Show is so much better.  The sound quality is amazing and the screen resolution is like watching a mini 4K tv.  I love being able to see my timers, events and list instead of having them read to me.  I purchased this on prime day, and it is worth every penny.  When the dot was given to me, I thought ""this is a cute novelty,  but I'll probably never use it"". Was I wrong!!  Echo is part of my daily routine,  and has made my life so much easier.","i love the echo show!! i have the dot and have been using that for the last 6 months,  but the show is so much better.  the sound quality is amazing and the screen resolution is like watching a mini 4k tv.  i love being able to see my timers, events and list instead of having them read to me.  i purchased this on prime day, and it is worth every penny.  when the dot was given to me, i thought ""this is a cute novelty,  but i'll probably never use it"". was i wrong!!  echo is part of my daily routine,  and has made my life so much easier.",positive,2
"So far I’m very pleased with my Echo Show.  The problem is, there’s so much it can do that I haven’t been able to explore the extent of its abilities! I got the special price as part of the Prime Day promotion...and you just can’t beat what you get for the price.  Very pleased with the sound. The video screen is sharp. Sometimes it takes a few tries to get Alexa to perform a command...but as I get to know the system better, I’m hoping that will improve.  One drawback in the music...I’ve noticed a lot of the songs from years past, are re-recordings by the original artist...but not the original recording itself.  Example: Secret Agent Man by Johnny Rivers...a “live”version is used, not the original version.  If I’m going to pay for Prime Music...I’d like to hear the original version of songs...not later recordings.  Or at least give me a choice of what I want to hear.  Otherwise, I am very pleased with my Echo Show.  So pleased in fact, that I bought a second one!","so far i’m very pleased with my echo show.  the problem is, there’s so much it can do that i haven’t been able to explore the extent of its abilities! i got the special price as part of the prime day promotion...and you just can’t beat what you get for the price.  very pleased with the sound. the video screen is sharp. sometimes it takes a few tries to get alexa to perform a command...but as i get to know the system better, i’m hoping that will improve.  one drawback in the music...i’ve noticed a lot of the songs from years past, are re-recordings by the original artist...but not the original recording itself.  example: secret agent man by johnny rivers...a “live”version is used, not the original version.  if i’m going to pay for prime music...i’d like to hear the original version of songs...not later recordings.  or at least give me a choice of what i want to hear.  otherwise, i am very pleased with my echo show.  so pleased in fact, that i bought a second one!",positive,2
"I like everything, about this ! Im still learning how to use it!","i like everything, about this ! im still learning how to use it!",positive,2
"It's like having another kid in the house; I have to constantly repeat myself.I can tell Alexa to do something clear as day, and according to the history, she hears something comeletely different.The device is really cool, and I like the concept, which is why it gets two stars. However, it just doesn't work as intended.I find myself irritated more often than not when I use this device.","it's like having another kid in the house; i have to constantly repeat myself.i can tell alexa to do something clear as day, and according to the history, she hears something comeletely different.the device is really cool, and i like the concept, which is why it gets two stars. however, it just doesn't work as intended.i find myself irritated more often than not when i use this device.",negative,0
Really easy to use,really easy to use,positive,2
It's great sound and video quality,it's great sound and video quality,positive,2
The way the music sounds is poor quality,the way the music sounds is poor quality,negative,0
"It does everything the Echo does, and more. Although I haven't and probably won't use the video functions. I had hoped that the display would be allow for more customization. It does not and is very limited. I would like the clock and weather to display in large text all of the time, it only displays in very small text. It also always has a line that says &#34;Tell Alexa to do this, or that&#34;, tips at the bottom of the screen. I would like to see that go away, but it won't. Sound quality is good, not as good as the big Echo, but good enough. I bought it on sale and think I got value for what I paid. I would have been disappointment had I of paid full price.","it does everything the echo does, and more. although i haven't and probably won't use the video functions. i had hoped that the display would be allow for more customization. it does not and is very limited. i would like the clock and weather to display in large text all of the time, it only displays in very small text. it also always has a line that says &#34;tell alexa to do this, or that&#34;, tips at the bottom of the screen. i would like to see that go away, but it won't. sound quality is good, not as good as the big echo, but good enough. i bought it on sale and think i got value for what i paid. i would have been disappointment had i of paid full price.",positive,2
Love my echo show!,love my echo show!,positive,2
I enjoy this thing. Its learning,i enjoy this thing. its learning,positive,2
Am very happy now that i can see.,am very happy now that i can see.,positive,2
All of my echo devices stopped communicating properly with Sonos devices upon connecting the echo show to my account. Asking any echo device to play music on Sonos baffled the system that had previously worked flawlessly. This went on for two weeks until I eventually solved the problem that neither Amazon nor Sonos could figure out.,all of my echo devices stopped communicating properly with sonos devices upon connecting the echo show to my account. asking any echo device to play music on sonos baffled the system that had previously worked flawlessly. this went on for two weeks until i eventually solved the problem that neither amazon nor sonos could figure out.,negative,0
"So far, I like it.  It is better than I expecting it.","so far, i like it.  it is better than i expecting it.",positive,2
Doesn't always respond to the wake word. This is my 3rd echo product and I have to say I am A little disappointed. Alexa voice assistant is great when it comes to controlling a connected home but has a lot to learn from google assistant when it comes to  getting answers for search queries.,doesn't always respond to the wake word. this is my 3rd echo product and i have to say i am a little disappointed. alexa voice assistant is great when it comes to controlling a connected home but has a lot to learn from google assistant when it comes to  getting answers for search queries.,positive,2
Good product.,good product.,positive,2
"After two weeks I am not sure if I like the ever present Alexa to have a screen as well.  I bought it to be a abay monitor combined with a wifi camera, and that works.  But the screen is always on unless you tell it to turn it off - instead of just a talking cylinder you now have a mini screen that not only talks to you but also writes out everything it says or shows accompanying video.  There is something about only audio that made Alexa different, no I some ways it is a TV that you can talk to.","after two weeks i am not sure if i like the ever present alexa to have a screen as well.  i bought it to be a abay monitor combined with a wifi camera, and that works.  but the screen is always on unless you tell it to turn it off - instead of just a talking cylinder you now have a mini screen that not only talks to you but also writes out everything it says or shows accompanying video.  there is something about only audio that made alexa different, no i some ways it is a tv that you can talk to.",neutral,1
It f****** sucks,it f****** sucks,negative,0
 ,,positive,2
Love being able to read the lyrics of my favorite songs.,love being able to read the lyrics of my favorite songs.,positive,2
"This thing is awesome for grocery lists, paired with the AnyList app. The flash briefing is very good too. My only complaint is that once you pause something, Alexa decides that you no longer want to listen to that thing. Forever. All in all, definitely worth the purchase.","this thing is awesome for grocery lists, paired with the anylist app. the flash briefing is very good too. my only complaint is that once you pause something, alexa decides that you no longer want to listen to that thing. forever. all in all, definitely worth the purchase.",positive,2
"Works great, video call function nice when communicating through drop-in","works great, video call function nice when communicating through drop-in",positive,2
 ,,positive,2
