original_review,comment_clean,sentiment_label,label_numeric
Love my Echo!,love my echo!,positive,2
Loved it!,loved it!,positive,2
"Sometimes while playing a game, you can answer a question correctly but Alexa says you got it wrong and answers the same as you.  I like being able to turn lights on and off while away from home.","sometimes while playing a game, you can answer a question correctly but alexa says you got it wrong and answers the same as you.  i like being able to turn lights on and off while away from home.",positive,2
"I have had a lot of fun with this thing. My 4 yr old learns about dinosaurs, i control the lights and play games like categories. Has nice sound when playing music as well.","i have had a lot of fun with this thing. my 4 yr old learns about dinosaurs, i control the lights and play games like categories. has nice sound when playing music as well.",positive,2
Music,music,positive,2
"I received the echo as a gift. I needed another Bluetooth or something to play music easily accessible, and found this smart speaker. Can’t wait to see what else it can do.","i received the echo as a gift. i needed another bluetooth or something to play music easily accessible, and found this smart speaker. can’t wait to see what else it can do.",positive,2
"Without having a cellphone, I cannot use many of her features. I have an iPad but do not see that of any use.  It IS a great alarm.  If u r almost deaf, you can hear her alarm in the bedroom from out in the living room, so that is reason enough to keep her.It is fun to ask random questions to hear her response.  She does not seem to be very smartbon politics yet.","without having a cellphone, i cannot use many of her features. i have an ipad but do not see that of any use.  it is a great alarm.  if u r almost deaf, you can hear her alarm in the bedroom from out in the living room, so that is reason enough to keep her.it is fun to ask random questions to hear her response.  she does not seem to be very smartbon politics yet.",neutral,1
I think this is the 5th one I've purchased. I'm working on getting one in every room of my house. I really like what features they offer specifily playing music on all Echos and controlling the lights throughout my house.,i think this is the 5th one i've purchased. i'm working on getting one in every room of my house. i really like what features they offer specifily playing music on all echos and controlling the lights throughout my house.,positive,2
looks great,looks great,positive,2
"Love it! I’ve listened to songs I haven’t heard since childhood! I get the news, weather, information! It’s great!","love it! i’ve listened to songs i haven’t heard since childhood! i get the news, weather, information! it’s great!",positive,2
"I sent it to my 85 year old Dad, and he talks to it constantly.","i sent it to my 85 year old dad, and he talks to it constantly.",positive,2
I love it! Learning knew things with it eveyday! Still figuring out how everything works but so far it's been easy to use and understand. She does make me laugh at times,i love it! learning knew things with it eveyday! still figuring out how everything works but so far it's been easy to use and understand. she does make me laugh at times,positive,2
"I purchased this for my mother who is having knee problems now, to give her something to do while trying to over come not getting around so fast like she did.She enjoys all the little and big things it can do...Alexa play this song, What time is it and where, and how to cook this and that!","i purchased this for my mother who is having knee problems now, to give her something to do while trying to over come not getting around so fast like she did.she enjoys all the little and big things it can do...alexa play this song, what time is it and where, and how to cook this and that!",positive,2
"Love, Love, Love!!","love, love, love!!",positive,2
Just what I expected....,just what i expected....,positive,2
"I love it, wife hates it.","i love it, wife hates it.",positive,2
Really happy with this purchase.  Great speaker and easy to set up.,really happy with this purchase.  great speaker and easy to set up.,positive,2
We have only been using Alexa for a couple of days and are having a lot of fun with our new toy. It like having a new household member! We are trying to learn all the different featues and benefits that come with it.,we have only been using alexa for a couple of days and are having a lot of fun with our new toy. it like having a new household member! we are trying to learn all the different featues and benefits that come with it.,positive,2
We love the size of the 2nd generation echo. Still needs a little improvement on sound,we love the size of the 2nd generation echo. still needs a little improvement on sound,positive,2
"I liked the original Echo. This is the same but shorter and with greater fabric/color choices. I miss the volume ring on top, now it's just the plus/minus buttons. Not a big deal but the ring w as comforting. :) Other than that, well I do like the use of a standard USB charger /port instead of the previous round pin. Other than that, I guess it sounds the same, seems to work the same, still answers to Alexa/Echo/Computer. So what's not to like? :)","i liked the original echo. this is the same but shorter and with greater fabric/color choices. i miss the volume ring on top, now it's just the plus/minus buttons. not a big deal but the ring w as comforting. :) other than that, well i do like the use of a standard usb charger /port instead of the previous round pin. other than that, i guess it sounds the same, seems to work the same, still answers to alexa/echo/computer. so what's not to like? :)",positive,2
Love the Echo and how good the music sounds playing off it. Alexa understands most commands but it is difficult at times for her to find specific playlists or songs on Spotify. She is good with Amazon Music but is lacking in other major programs.,love the echo and how good the music sounds playing off it. alexa understands most commands but it is difficult at times for her to find specific playlists or songs on spotify. she is good with amazon music but is lacking in other major programs.,positive,2
"We love Alexa! We use her to play music, play radio through iTunes, play podcasts through Anypod, and set reminders. We listen to our flash briefing of news and weather every morning. We rely on our custom lists. We like being able to voice control the volume. We're sure we'll continue to find new uses.Sometimes it's a bit frustrating when Alexa doesn't understand what we're saying.","we love alexa! we use her to play music, play radio through itunes, play podcasts through anypod, and set reminders. we listen to our flash briefing of news and weather every morning. we rely on our custom lists. we like being able to voice control the volume. we're sure we'll continue to find new uses.sometimes it's a bit frustrating when alexa doesn't understand what we're saying.",positive,2
"Have only had it set up for a few days. Still adding smart home devices to it. The speaker is great for playing music. I like the size, we have it stationed on the kitchen counter and it’s not intrusive to look at.","have only had it set up for a few days. still adding smart home devices to it. the speaker is great for playing music. i like the size, we have it stationed on the kitchen counter and it’s not intrusive to look at.",positive,2
I love it. It plays my sleep sounds immediately when I ask,i love it. it plays my sleep sounds immediately when i ask,positive,2
"I got a second unit for the bedroom, I was expecting the sounds to be improved but I didnt really see a difference at all.  Overall, not a big improvement over the 1st generation.","i got a second unit for the bedroom, i was expecting the sounds to be improved but i didnt really see a difference at all.  overall, not a big improvement over the 1st generation.",neutral,1
Amazing product,amazing product,positive,2
"I love my Echo. It's easy to operate, loads of fun.It is everything as advertised. I use it mainly to play my favorite tunes and test Alexa's knowledge.","i love my echo. it's easy to operate, loads of fun.it is everything as advertised. i use it mainly to play my favorite tunes and test alexa's knowledge.",positive,2
Sounds great!! Love them!,sounds great!! love them!,positive,2
"Fun item to play with and get used to using.  Sometimes has hard time answering the questions you ask, but I think it will be better.","fun item to play with and get used to using.  sometimes has hard time answering the questions you ask, but i think it will be better.",positive,2
Just like the other one,just like the other one,positive,2
Still learning all the capabilities...but so far pretty pretty pretty good,still learning all the capabilities...but so far pretty pretty pretty good,positive,2
I like it,i like it,positive,2
"She works well. Needs a learning command  for unique, owners and users like. Alexa “learn” Tasha’s birthday.  Or Alexa “learn” my definition of Fine. Etc. other than that she is great","she works well. needs a learning command  for unique, owners and users like. alexa “learn” tasha’s birthday.  or alexa “learn” my definition of fine. etc. other than that she is great",positive,2
The speakers sound pretty good for being so small and setup is pretty easy.  I bought two and the reason I only rate it a 3 is I have followed the instructions for synching music to both units.  I know I've done it correctly but they won't sync.  That was my primary motivation for purchasing multiple units.,the speakers sound pretty good for being so small and setup is pretty easy.  i bought two and the reason i only rate it a 3 is i have followed the instructions for synching music to both units.  i know i've done it correctly but they won't sync.  that was my primary motivation for purchasing multiple units.,neutral,1
This device is awesome!,this device is awesome!,positive,2
I bought this to compare the speaker quality to our first generation speaker and i like the sound better.  I will ship this to my daughter though because I like the fact that my first generation has a chargeable base that we bought which keeps it more mobile and she needs a better sound than what she has now.,i bought this to compare the speaker quality to our first generation speaker and i like the sound better.  i will ship this to my daughter though because i like the fact that my first generation has a chargeable base that we bought which keeps it more mobile and she needs a better sound than what she has now.,positive,2
"Love my Echo. Still learning all the things it will do. Wasn’t able to follow instructions included in the package, but found a great one on U-Tube.","love my echo. still learning all the things it will do. wasn’t able to follow instructions included in the package, but found a great one on u-tube.",positive,2
Speaker is better than 1st generation Echo,speaker is better than 1st generation echo,positive,2
"This thing is way cool!  You should get one.  If you want to be cool, that is.","this thing is way cool!  you should get one.  if you want to be cool, that is.",positive,2
"This is my first digital assistant so I'm giving this a good review. Speaker is really good for the cheap price on Prime day. Fun to play with and can be used as an alarm clock (That's what I was going to get in the first place, but I ended up with Echo). If you haven't had a go with one then definitely try it!What I like best is the number of other devices that it can connect with. My purchase came with a Smart Plug for $10 which I connect my lamp to. Alexa, turn of the lights!","this is my first digital assistant so i'm giving this a good review. speaker is really good for the cheap price on prime day. fun to play with and can be used as an alarm clock (that's what i was going to get in the first place, but i ended up with echo). if you haven't had a go with one then definitely try it!what i like best is the number of other devices that it can connect with. my purchase came with a smart plug for $10 which i connect my lamp to. alexa, turn of the lights!",positive,2
My husband likes being able to use it to listen to music.  I wish we knew all it's capabilities,my husband likes being able to use it to listen to music.  i wish we knew all it's capabilities,positive,2
"My Android would not allow Alexa to connect. Fortunately, my sister was here with her Apple cell. After an hour+ tech support fixed the glitches. We are up and running.","my android would not allow alexa to connect. fortunately, my sister was here with her apple cell. after an hour+ tech support fixed the glitches. we are up and running.",positive,2
So far so good,so far so good,positive,2
Tried to play certain broadway shows like Camelot and it gives ne the group Camelot.,tried to play certain broadway shows like camelot and it gives ne the group camelot.,positive,2
Great,great,positive,2
Very satisfied with the Echo. Alexa now controls the lights in my family room and my wife can listen to Jimmy Buffet by just asking Alexa.,very satisfied with the echo. alexa now controls the lights in my family room and my wife can listen to jimmy buffet by just asking alexa.,positive,2
"It's like Siri, in fact, Siri answers more accurately then Alexa.  I don't see a real need for it in my household, though it was a good bargain on prime day deals.","it's like siri, in fact, siri answers more accurately then alexa.  i don't see a real need for it in my household, though it was a good bargain on prime day deals.",negative,0
Love my Echo. Still learning how every thing works but having tons of fun.,love my echo. still learning how every thing works but having tons of fun.,positive,2
I love you so much,i love you so much,positive,2
No different than Apple. To play a specific list of music you must have an Amazon of Spotify “plus/prime/etc” account.  So you must pay to play “your” music.  3 stars for that reason.  Everything else is 👍🏻 .,no different than apple. to play a specific list of music you must have an amazon of spotify “plus/prime/etc” account.  so you must pay to play “your” music.  3 stars for that reason.  everything else is 👍🏻 .,neutral,1
"Excelente, lo unico es que no esta en español.","excelente, lo unico es que no esta en español.",positive,2
"I'm still learning how to use it, but so far my Echo is great! The sound is actually much better than I was expecting.","i'm still learning how to use it, but so far my echo is great! the sound is actually much better than i was expecting.",positive,2
Works as you’d expect and then some. Also good sound quality considering price (70.00 on sale) and features.,works as you’d expect and then some. also good sound quality considering price (70.00 on sale) and features.,positive,2
The sound from this Echo 2nd Generation is phenomenal!  Not to mention that I just love Alexa!  She is very helpful.,the sound from this echo 2nd generation is phenomenal!  not to mention that i just love alexa!  she is very helpful.,positive,2
like google better,like google better,neutral,1
Just had to have it and now lets play and learn how to get the most out of it.,just had to have it and now lets play and learn how to get the most out of it.,positive,2
Works as advertised. Very easy to setup. Still learning what this can do.,works as advertised. very easy to setup. still learning what this can do.,positive,2
Great sound and easy to set up.,great sound and easy to set up.,positive,2
"Love Alexa, bought others for friends","love alexa, bought others for friends",positive,2
Love the echo I purchased it for company for my husband he is 83 and Alexa is great all he has to do is say her name and she tells him a joke and plays his favorite songs,love the echo i purchased it for company for my husband he is 83 and alexa is great all he has to do is say her name and she tells him a joke and plays his favorite songs,positive,2
😍,😍,positive,2
Love being able to listen to music easily. Still learning all the features available,love being able to listen to music easily. still learning all the features available,positive,2
"Did t really know what I could use this device for. Used it for a few things, but need an overview","did t really know what i could use this device for. used it for a few things, but need an overview",positive,2
Love this just wish it had a built in hub,love this just wish it had a built in hub,positive,2
I use it primarily to play music.  It works wonderfully!  Still getting used to some of the many things it will do.  Amazon has sent several tips since I got it. Thanks for all your help!,i use it primarily to play music.  it works wonderfully!  still getting used to some of the many things it will do.  amazon has sent several tips since i got it. thanks for all your help!,positive,2
How easy if was to set up.,how easy if was to set up.,positive,2
Fast response which was amazing.  Clear concise answers and sound quality is fantastic.  I am still getting used to Alexia and have not usde Echo to its full extent.,fast response which was amazing.  clear concise answers and sound quality is fantastic.  i am still getting used to alexia and have not usde echo to its full extent.,positive,2
You’re all I need...na na nana!,you’re all i need...na na nana!,positive,2
Does everything as expected and more.,does everything as expected and more.,positive,2
"I love my Echo!  Works just like they said it would. I don't have a &#34;smart&#34; home, so I cannot speak about that function, but everything else about it is good.","i love my echo!  works just like they said it would. i don't have a &#34;smart&#34; home, so i cannot speak about that function, but everything else about it is good.",positive,2
Great sound in a small package—easy to set up and use; fun to own.,great sound in a small package—easy to set up and use; fun to own.,positive,2
Works and sounds great.,works and sounds great.,positive,2
The sound is amazing and many collections of all music,the sound is amazing and many collections of all music,positive,2
Setting up,setting up,positive,2
She doesn’t always listen,she doesn’t always listen,positive,2
It’s awesome,it’s awesome,positive,2
"I bought this because it can control fios television. It works well. I’m hoping over time it will do more to control fios. Then I discovered all the other things Alexa can do. Play music you ask for. Great sound from Alexa. Play games. Play radio stations. Play old time radio programs like the Long Ranger. Alexa has many “apps” you can add to her abilities. The other day I played Madlibs. Great fun. Also Alexa can control household appliances. I just purchased Alexa compatible power strips to control lighting, fans and TV components. I’m looking forward to implementing this controll. You can also add other Alexa components to have chosen music to play in all rooms where the components are located.","i bought this because it can control fios television. it works well. i’m hoping over time it will do more to control fios. then i discovered all the other things alexa can do. play music you ask for. great sound from alexa. play games. play radio stations. play old time radio programs like the long ranger. alexa has many “apps” you can add to her abilities. the other day i played madlibs. great fun. also alexa can control household appliances. i just purchased alexa compatible power strips to control lighting, fans and tv components. i’m looking forward to implementing this controll. you can also add other alexa components to have chosen music to play in all rooms where the components are located.",positive,2
The speaker has excellent sound and works perfectly!,the speaker has excellent sound and works perfectly!,positive,2
I LIKE IT ALL,i like it all,positive,2
I love it. It does everything,i love it. it does everything,positive,2
I was a little nervous when I received my new Echo as I'm not really Tech savvy. I found it a bit intimidating at first but it didn't take me to long to figure it out!! I'm very happy with my purchase and now thinking of adding an echo spot!!!,i was a little nervous when i received my new echo as i'm not really tech savvy. i found it a bit intimidating at first but it didn't take me to long to figure it out!! i'm very happy with my purchase and now thinking of adding an echo spot!!!,positive,2
I like it and still learning how to use it.,i like it and still learning how to use it.,positive,2
Great technology!! Can't believe the speaker volume and quality is so wonderful. Wish I had bought another one!,great technology!! can't believe the speaker volume and quality is so wonderful. wish i had bought another one!,positive,2
"I purchased an echo dot for my husband for Fathers Day.  He uses it constantly and after hearing the quality of sound of the Echo (2nd Generation), It was a no-brainer.  Best gift ever!","i purchased an echo dot for my husband for fathers day.  he uses it constantly and after hearing the quality of sound of the echo (2nd generation), it was a no-brainer.  best gift ever!",positive,2
Works fine!!,works fine!!,positive,2
 ,,positive,2
Clear music,clear music,positive,2
"Fun to use, good sound quality","fun to use, good sound quality",positive,2
The echo works well. I was able to sync it with my other Amazon music devices.,the echo works well. i was able to sync it with my other amazon music devices.,positive,2
"Works great, but I don't think Amazon should charge another cent for unlimited music when you 1) Have Prime AND 2) Buy an Echo.","works great, but i don't think amazon should charge another cent for unlimited music when you 1) have prime and 2) buy an echo.",positive,2
Already had an Echo Dot. The Echo is even better with fuller sound. Also during setup it now lets phone calls to be made to my contact list which is great!,already had an echo dot. the echo is even better with fuller sound. also during setup it now lets phone calls to be made to my contact list which is great!,positive,2
The speaker sounds really good,the speaker sounds really good,positive,2
Good sound works well,good sound works well,positive,2
Love it and Alexa. I am not very savvy but support was very helpful and patient.,love it and alexa. i am not very savvy but support was very helpful and patient.,positive,2
"Love it! I was thinking about getting one and when the prime day discount was offered, I could not pass it up! It's fun to ask Alexa to play any song or group and she comes up with a playlist from Amazon Prime Music. You can also connect your iPhone with bluetooth and play music with Pandora or YouTube videos using Alexa as a speaker. I've been having fun asking Alexa different types of questions or for information like weather, news or even the time in other countries. The only downside is if you have limited data on your wifi plan, because Alexa uses burns it up when playing music.","love it! i was thinking about getting one and when the prime day discount was offered, i could not pass it up! it's fun to ask alexa to play any song or group and she comes up with a playlist from amazon prime music. you can also connect your iphone with bluetooth and play music with pandora or youtube videos using alexa as a speaker. i've been having fun asking alexa different types of questions or for information like weather, news or even the time in other countries. the only downside is if you have limited data on your wifi plan, because alexa uses burns it up when playing music.",positive,2
"We like it all so far, but have a lot to try out yet.","we like it all so far, but have a lot to try out yet.",positive,2
Love it - am using it strictly for music now and it's great!,love it - am using it strictly for music now and it's great!,positive,2
"Love the Echo !!! I love the size, material and speaker quality. I have it hooked up to one light easily and will work on additional lights and thermostat. Next is Echo Dot for bedroom. There is a lot more to do with Echo that you think. Traffic, Weather, Trivia, etc.","love the echo !!! i love the size, material and speaker quality. i have it hooked up to one light easily and will work on additional lights and thermostat. next is echo dot for bedroom. there is a lot more to do with echo that you think. traffic, weather, trivia, etc.",positive,2
Love it!,love it!,positive,2
The entire family loves Alexa Echo. She’s now a part of this family.,the entire family loves alexa echo. she’s now a part of this family.,positive,2
"Great fun getting to know all the functions of this product.  WOW -- family fun and homework help.  Talking with other grandchildren,who also have an Echo, is a HUGE bonus.  Can't wait to learn more and more and more","great fun getting to know all the functions of this product.  wow -- family fun and homework help.  talking with other grandchildren,who also have an echo, is a huge bonus.  can't wait to learn more and more and more",positive,2
Love it!,love it!,positive,2
"awesome thing, love Alexa","awesome thing, love alexa",positive,2
It worked exactly as expected and the speaker has great sound. It is perfect for my classroom!,it worked exactly as expected and the speaker has great sound. it is perfect for my classroom!,positive,2
"LOVE, LOVE this new little gadget.  Has  made our lives so much easier.  it's like having our own personal secretary living here in the home.  We hardly need our CD's anymore, since ALEXA plays everything we need.  Going to get the Alexa DOTS soon for more rooms.  Thanks!!","love, love this new little gadget.  has  made our lives so much easier.  it's like having our own personal secretary living here in the home.  we hardly need our cd's anymore, since alexa plays everything we need.  going to get the alexa dots soon for more rooms.  thanks!!",positive,2
